ID,conversation_id_str,created_at,favorite_count,full_text,id_str,lang,quote_count,reply_count,retweet_count,tweet_url,user_id_str,username,translated_text,sentiment
1011,1.81E+18,Sun Jul 14 02:06:32 +0000 2024,4,Day 16 with narcissism PHOTOGRAPHER JAEMIN 1ST EXHIBITION,1.81E+18,en,0,1,2,https://x.com/sweeetnajae/status/1812307663642067281,1.60E+18,sweeetnajae,Day 16 with narcissism PHOTOGRAPHER JAEMIN 1ST EXHIBITION,Positive
1012,1.81E+18,Sun Jul 14 01:39:53 +0000 2024,1,PHOTOGRAPHER JAEMIN 1ST EXHIBITION,1.81E+18,en,0,1,1,https://x.com/Yourwidia_/status/1812300954676675018,563482663,Yourwidia_,PHOTOGRAPHER JAEMIN 1ST EXHIBITION,Neutral
1013,1.81E+18,Sun Jul 14 02:06:43 +0000 2024,0,DAY 16 ‍ JAEMIN PHOTOGRAPHER DEBUT,1.81E+18,en,0,0,0,https://x.com/byieev/status/1812307708055539776,4741295982,byieev,DAY 16 ‍ JAEMIN PHOTOGRAPHER DEBUT,Positive
1014,1.81E+18,Sun Jul 14 01:59:02 +0000 2024,0,day 16 PHOTOGRAPHER JAEMIN 1ST EXHIBITION,1.81E+18,en,0,12,0,https://x.com/pillkyuu_/status/1812305774825353260,1.72E+18,pillkyuu_,day 16 PHOTOGRAPHER JAEMIN 1ST EXHIBITION,Positive
1015,1.81E+18,Sat Jul 13 16:11:56 +0000 2024,8140,love scenario ੭ᡣ𐭩,1.81E+18,en,146,10,4110,https://x.com/p020899/status/1812158028575330580,1.80E+18,p020899,love scenario ੭ᡣ𐭩,Neutral
1016,1.81E+18,Sat Jul 13 16:00:57 +0000 2024,536,แจกน้ำหอม ที่แจมินทำขึ้น แบ่งใส่ขวดแบ่ง 1มล ได้2กลิ่น ให้กับคนที่เทรนแท็กทุกวันค่ะ เราขอเช็กทล ประกาศวันที่ 16 นะคับ รี เมนชั่นนี้ด้วยนะคะ JAEMIN PHOTOGRAPHER DEBUT,1.81E+18,th,3,959,1704,https://x.com/Bae_deep05/status/1812155262939381923,7.48E+17,Bae_deep05,"Handing out perfume that Jaemin made Divide into a 1 ml bottle, get 2 scents, for those who train to tag every day. We would like to check the announcement on the 16th. Please remember this comment. JAEMIN PHOTOGRAPHER DEBUT",Positive
1017,1.81E+18,Sat Jul 13 16:45:30 +0000 2024,0,ballcap narcissism grey ver ayoo dipersilahkan yg mau opslot atau jual pls hmu aja ball cap jaemin narcissism,1.81E+18,in,0,4,0,https://x.com/Jaemssi_dnk/status/1812166472170696922,1.28E+18,Jaemssi_dnk,"ball cap narcissism gray ver come on, those who want to oplot or sell are welcome, just hmu ball cap jaemin narcissism",Positive
1018,1.81E+18,Sat Jul 13 16:53:35 +0000 2024,0,เทสดี หล่อ รวย รู้จักใช้เงิน สนใจเศรษฐกิจโลกและการลงทุน ช่างภาพ นักร้อง นักแสดง ทำอาหารเก่ง พึ่งพาได้ เข้าใจแฟนคลับ วางตัวดี ให้เกียรติคนอื่น PHOTOGRAPHER JAEMIN 1ST EXHIBITION,1.81E+18,th,0,0,1,https://x.com/P_I_Cia/status/1812168508987584570,1605534002,P_I_Cia,"Tasty, handsome, rich, knows how to use money. Interested in the world economy and investment. Photographer, singer, actor, good at cooking, dependable, understands fans, behaves well, respects others. PHOTOGRAPHER JAEMIN 1ST EXHIBITION",Positive
1019,1.81E+18,Sat Jul 13 23:22:41 +0000 2024,0,อยากบอกว่าน้องจัดงานได้ดีจริง รูปทุกรูปในงานคือดีมาก ทั้งรูปเมมเบอ รูปแลนสเคป ทุกอย่างลงตัวหมด การจัดแสง คำบรรยาย คือมันลงตัวไปหมดเลย น้องแจมิน เก่งมาก,1.81E+18,th,0,0,0,https://x.com/pa_r_ty_tk/status/1812266428369891755,3288421758,pa_r_ty_tk,"I want to say that you really organized the event well. Every picture in the event is very good. Both the member photos, the landscape photos, everything is perfect. The lighting, the narration, it's all perfect. Little Jaemin is very talented.",Positive
1020,1.81E+18,Sat Jul 13 23:21:14 +0000 2024,1,wtt มีใครสนใจอยากแลกลายบัตรเข้างานนิทรรศการแจมินมั้ยคะ เรา มีบัตรเข้างานสีแดง คุณ บัตรเข้างานสีขาว ตามรูป ใครสนใจแลกบอกได้นะคะเราได้ซ้ำสีแดงทุกรอบที่เข้าเลยค่ะ,1.81E+18,th,0,2,2,https://x.com/giftxsmile/status/1812266065524855082,1114623666,giftxsmile,"wtt Is anyone interested in exchanging pattern tickets to go to Jaemin's exhibition? We have a red entry ticket, you have a white entry ticket as shown in the picture. If anyone is interested in exchanging, please let me know. We get red ones every time we enter.",Neutral
1021,1.81E+18,Sun Jul 14 00:00:00 +0000 2024,31,สวัสดีเช้าวันอาทิตย์ค่ะ นาดุ๋งแวะมาแมสเทรนด์ติดแท็กให้แจมินกันเยอะ ๆ น้า ขอ 1 รี 1 เฟบ 1 เมนชั่น เพื่อให้กำลังใจให้คุณช่างภาพคนเก่งกันค่ะ ขอให้วันนี้เป็นวันที่ดีของทุกคนเช่นเคยนะคะ PHOTOGRAPHER JAEMIN 1ST EXHIBITION,1.81E+18,th,0,24,50,https://x.com/gogop1nku/status/1812275818724225253,1.42E+18,gogop1nku,"Good morning Sunday. Nadung stopped by to mass trend and tag Jaemin a lot. I would like 1 Re, 1 Feb, 1 Mention to give encouragement to the talented photographer. May today be a good day for everyone as always. PHOTOGRAPHER JAEMIN 1ST EXHIBITION",Positive
1022,1.81E+18,Sun Jul 14 00:01:00 +0000 2024,6,สวัสดีเช้าวันอาทิตย์ที่แสนสดใสค่ PHOTOGRAPHER JAEMIN 1ST EXHIBITION,1.81E+18,und,0,7,15,https://x.com/onyourjbow/status/1812276070365946136,1.12E+18,onyourjbow,"Good morning, a bright Sunday. PHOTOGRAPHER JAEMIN 1ST EXHIBITION",Positive
1023,1.81E+18,Sat Jul 13 17:41:41 +0000 2024,1,재민 전시회 나르시시즘 엠디 대리구매 댈구 NARCISSISM 7 14 방문 EMS⭕ ENG⭕ 품절시 전액 환불 NCT DREAM 엔시티 드림 JAEMIN 사진전 댈구 마크 런쥔 제노 해찬 천러 지성 판매 양도 포카 후드 엘피 포토북 lp pc photocard e hibition goods MD pro y wts sell,1.81E+18,ko,0,1,0,https://x.com/NpUfm2/status/1812180613312749609,1.33E+18,NpUfm2,Jaemin Exhibition Narcissism MD Proxy Purchase Dalgu NARCISSISM 7 14 Visit EMS⭕ ENG⭕ Full refund if sold out NCT DREAM NCT Dream JAEMIN Photo Exhibition Dalgu Mark Renjun Zeno Haechan Chenle Jisung Sales Transfer Poka Hood LP Photobook lp pc photocard e hibition goods MD pro y wts sell,Neutral
1024,1.81E+18,Sun Jul 14 00:02:54 +0000 2024,19,Day 16 แล้วว วีคท้ายของนิทรรศการ ชวนทุกคนมาติดแท็กชื่นชมหรือเพิ่มเอนเกจให้คุณช่างภาพคนเก่งกันฮะ PHOTOGRAPHER JAEMIN 1ST EXHIBITION,1.81E+18,th,0,0,33,https://x.com/tonyjaem/status/1812276550890598715,2290414357,tonyjaem,"Day 16 already, the last week of the exhibition. Invite everyone to tag and admire or add more value to this talented photographer. PHOTOGRAPHER JAEMIN 1ST EXHIBITION",Positive
1025,1.81E+18,Sat Jul 13 22:04:43 +0000 2024,0,NARCISSISM JAEMIN 1st PHOTO EXHIBITION VISITOR GUIDE NOTICE 成功時入金 先着順締め切り Yes24 グローバルアカウント必要 Reservation date 7 10 7 19,1.81E+18,ja,0,0,0,https://x.com/_Mari_096/status/1812246807394607129,1.25E+18,_Mari_096,NARCISSISM JAEMIN 1st PHOTO EXHIBITION VISITOR GUIDE NOTICE Deposit upon success First come first served Deadline Yes24 Global account required Reservation date 7 10 7 19,Neutral
1026,1.81E+18,Sat Jul 13 16:10:15 +0000 2024,11,น้องแจมินเทสโคตรดี ส่วนพี่ เทสโก้โลตัส PHOTOGRAPHER JAEMIN 1ST EXHIBITION,1.81E+18,und,0,0,44,https://x.com/shabushop_/status/1812157602278846959,1643328180,shabushop_,"Nong Jaemin did a great test, while older brother Tesco Lotus PHOTOGRAPHER JAEMIN 1ST EXHIBITION",Positive
1027,1.81E+18,Sat Jul 13 17:02:19 +0000 2024,10,ชอบที่แจมินถ่ายรูปเมมเบอร์แล้วหน้าข้างๆเขียนว่า Making memories อีโมมาก JAEMIN PHOTOGRAPHER DEBUT,1.81E+18,und,0,0,26,https://x.com/beembaebae/status/1812170704345080231,1.69E+18,beembaebae,I like that Jaemin took a photo of the members and the next page said Making memories. Very emo. JAEMIN PHOTOGRAPHER DEBUT,Positive
1028,1.81E+18,Sat Jul 13 16:59:21 +0000 2024,19,บันทึกย้อนหลัง PHOTOGRAPHER JAEMIN 1ST EXHIBITION 13 07 67 มีเรื่องราวดีดีเกิดขึ้นมากมาย โดยมี lucky number 13 ที่อวยพรให้ตลอดวันเป็นไปอย่างราบรื่น ดำเนินนิทรรศการ มาถึงวันที่ 13 พอดี และร่วมงานอีเว้นท์ในวันนั้นด้วยเช่นกัน,1.81E+18,th,0,0,55,https://x.com/JellybearJeno/status/1812169960824930551,1.51E+18,JellybearJeno,"Past record PHOTOGRAPHER JAEMIN 1ST EXHIBITION 13 07 67 There were many good things that happened, with lucky number 13 wishing the whole day to go smoothly. Carrying out the exhibition, it arrived on the 13th and participating in events on that day as well.",Positive
1029,1.81E+18,Sat Jul 13 16:50:19 +0000 2024,1,บ๊ายบายวันที่ 15 ไปกับคุณเจ้าของนิทรรศการคนเก่ง PHOTOGRAPHER JAEMIN 1ST EXHIBITION,1.81E+18,und,0,1,1,https://x.com/babynanameow_/status/1812167685608034643,1.73E+18,babynanameow_,"Goodbye on the 15th, go with the owner of the talented exhibition PHOTOGRAPHER JAEMIN 1ST EXHIBITION.",Positive
1030,1.81E+18,Sat Jul 13 17:51:26 +0000 2024,1,Day 15 PHOTOGRAPHER JAEMIN 1ST EXHIBITION,1.81E+18,en,0,0,0,https://x.com/najaemph/status/1812183064707313836,1.00E+18,najaemph,Day 15 PHOTOGRAPHER JAEMIN 1ST EXHIBITION,Positive
1031,1.81E+18,Sat Jul 13 17:26:20 +0000 2024,0,มีใครเปิดหาร LP ster set มาร์ค รูปนี้มั้ยคับ เดมมาได้เลย,1.81E+18,th,0,0,0,https://x.com/starfishpx/status/1812176748127375535,8.49E+17,starfishpx,Is there anyone who can find the LP ster set with this mark? You can send it to me.,Neutral
1032,1.81E+18,Sat Jul 13 20:59:29 +0000 2024,0,Rt ลด 10 เว็บส่งช้ากว่ารอบวันที่ 3 ส่งเดือน 8 9 NARCISSISM JAEMIN 1st PHOTO EXHIBITION รอบแอร์ กดแล้ว ว่าง magazine 1 เล่ม ค่ะ ราคาตามรูป ชิ้นเล็ก 50 ชิ้นใหญ่ 60 pls dm กดได้จนกว่าของจะหมด,1.81E+18,th,0,0,0,https://x.com/GucciGangKPOP/status/1812230390217847198,9.84E+17,GucciGangKPOP,"Rt discount 10 websites, delivery later than the 3rd day, delivery in the 8th month 9 NARCISSISM JAEMIN 1st PHOTO EXHIBITION, air conditioner cycle, press and there is 1 magazine available, price as shown in the picture, small pieces 50, large pieces 60, pls dm, press until out of stock.",Neutral
1033,1.81E+18,Sat Jul 13 17:55:51 +0000 2024,0,YOKS KERE BANGE KAMU JAEMI SAYANGKU CINTAK IN ‼ PROUD OF U SAYAN ‍ PHOTOGRAPHER JAEMIN 1ST EXHIBITION,1.81E+18,in,0,0,0,https://x.com/napcyvi/status/1812184179729395910,1.72E+18,napcyvi,YOKS KEREN BANGET YOU JAEMIN DARLING LOVE IN ‼ PROUD OF UAYAN ‍ PHOTOGRAPHER JAEMIN 1ST EXHIBITION ,Positive
1034,1.81E+18,Sat Jul 13 18:55:25 +0000 2024,1,Rt ลด 10 เว็บส่งช้ากว่ารอบวันที่ 3 ส่งเดือน 8 9 NARCISSISM JAEMIN 1st PHOTO EXHIBITION รอบแอร์ Lp มีแค่แจมินคนเดียวค่ะ ราคาตามรูป ชิ้นเล็ก 50 ชิ้นใหญ่ 60 pls dm กดได้จนกว่าของจะหมด,1.81E+18,th,0,0,2,https://x.com/GucciGangKPOP/status/1812199169203053004,9.84E+17,GucciGangKPOP,"Rt discount 10 websites, delivery later than the 3rd day, delivery in the 8th month 9 NARCISSISM JAEMIN 1st PHOTO EXHIBITION around the air conditioner Lp, there is only Jaemin. Price as in the picture, small pieces 50, large pieces 60, pls dm, press until out of stock.",Neutral
1035,1.81E+18,Sat Jul 13 12:15:11 +0000 2024,17,240711 star river fancall op asked jaemin about NARCISSISM talk event the good thing is the time for talking during fansign was really short the talk event s time was separate so i could talk more and i like how we re him and fans a lot closer,1.81E+18,en,0,1,4,https://x.com/aijiyw/status/1812098445966242147,977529037,aijiyw,240711 star river fancall op asked jaemin about NARCISSISM talk event the good thing is the time for talking during fansign was really short the talk event s time was separate so i could talk more and i like how we re him and fans a lot closer,Positive
1037,1.81E+18,Sat Jul 13 14:12:19 +0000 2024,18,드 디 어 잼시회를 보다 너무너무 행복했오요,1.81E+18,ko,1,0,1,https://x.com/JMXJNX/status/1812127925082402842,1.47E+18,JMXJNX,I was so happy to finally see the Jam show.,Positive
1038,1.81E+18,Sat Jul 13 14:48:55 +0000 2024,485,ใครอยู่บ้า มาส่งท้ายวันที่ 15 กันค่ะ พรุ่งนี้มาสู้ ๆ กันใหม่น้า รี ไลค์ เมนชั่น เน้นไลค์ PHOTOGRAPHER JAEMIN 1ST EXHIBITION,1.81E+18,th,0,229,636,https://x.com/jmismybabe/status/1812137136919044265,7.84E+17,jmismybabe,"Whoever is crazy, come and say goodbye to the 15th. Tomorrow, let's fight again. Re Like Mention Emphasis on Like PHOTOGRAPHER JAEMIN 1ST EXHIBITION",Positive
1039,1.81E+18,Sat Jul 13 14:07:04 +0000 2024,1313,แจกให้กับช่างภาพคนเก่ง แจก LP เจโน่ กติกา เฟบ รี เมนชั่น ขออนุญาตสุ่มแจกให้เฉพาะคนที่ทำตามกติกานะคะ สุ่มแจกพรุ่งนี้ตอน 3 ทุ่มนะคะ JAEMIN PHOTOGRAPHER DEBUT,1.81E+18,th,1,1139,1649,https://x.com/jjpiyachat/status/1812126602580328796,1.61E+18,jjpiyachat,Give away to talented photographers. Give away LP Geno. February Remention rules. Please allow random distribution to only people who follow the rules. Random giveaway tomorrow at 9 PM. JAEMIN PHOTOGRAPHER DEBUT,Positive
1040,1.81E+18,Sat Jul 13 13:48:46 +0000 2024,12,จาหมดวันที่15แล้ คุณช่างภาพก็เก่งเหมินเดิมม แว้บมาติดแท็กให้รอบค่ะสักหน่อยย PHOTOGRAPHER JAEMIN 1ST EXHIBITION,1.81E+18,th,0,11,33,https://x.com/tonyjaem/status/1812121997419421959,2290414357,tonyjaem,It expires on the 15th. You're a really good photographer. Please take a moment to tag me. PHOTOGRAPHER JAEMIN 1ST EXHIBITION,Positive
1041,1.81E+18,Sat Jul 13 13:52:41 +0000 2024,2,อีกไม่กี่ชั่วโมงก็จะหมดวันแล้วน้า day 15 ของนิทรรศการ ก็ผ่านไปอย่างราบรื่นเลยใช่ไหมคะ มีคนคอยส่งกำลังใจให้คุณช่างภาพคนเก่งเยอะเลยน้า PHOTOGRAPHER JAEMIN 1ST EXHIBITION,1.81E+18,th,0,1,9,https://x.com/onyourbabymm/status/1812122984334979574,8.97E+17,onyourbabymm,"In just a few hours the day will be over. Day 15 of the exhibition went smoothly, right? There are many people waiting to give encouragement to you, a talented photographer. PHOTOGRAPHER JAEMIN 1ST EXHIBITION",Positive
1042,1.81E+18,Sat Jul 13 13:27:28 +0000 2024,2,BUY on web ⬇ ⭕,1.81E+18,en,0,0,0,https://x.com/voborot/status/1812116637203763549,1.79E+18,voborot,BUY on web ⬇ ⭕,Neutral
1043,1.81E+18,Sat Jul 13 14:25:08 +0000 2024,1,수고했어용 감사합니다 PHOTOGRAPHER JAEMIN 1ST EXHIBITION,1.81E+18,ko,0,2,5,https://x.com/jrnrmnr_/status/1812131149092946371,1.36E+18,jrnrmnr_,Thank you for your hard work PHOTOGRAPHER JAEMIN 1ST EXHIBITION,Positive
1044,1.81E+18,Sat Jul 13 13:51:00 +0000 2024,1,ผ่านไปอีกวันแล้วว ไวมากเลย นิทรรศการวันนี้ก็ออกมาดีมาก ๆ เลยใช่ไหมคะ ยังไงก็ขอให้คืนนี้เป็นคืนที่ดีของแจมนะ พรุ่งนี้มาส่งกำลังใจให้แจมมี่กันต่อ PHOTOGRAPHER JAEMIN 1ST EXHIBITION,1.81E+18,th,0,0,8,https://x.com/_bmxxpnp/status/1812122559577751733,9.94E+17,_bmxxpnp,"Another day has passed so quickly. Today's exhibition turned out really well, right? Anyway, I hope tonight is a good night for Jam. Tomorrow, let's continue sending encouragement to Jammy. PHOTOGRAPHER JAEMIN 1ST EXHIBITION",Positive
1045,1.81E+18,Sat Jul 13 13:22:13 +0000 2024,2,คุณตากล้องคนเก่งกำลังพักผ่อนอยู่ใช่มั้ยน้ PHOTOGRAPHER JAEMIN 1ST EXHIBITION,1.81E+18,und,0,0,6,https://x.com/onyourjbow/status/1812115316908175608,1.12E+18,onyourjbow,"The talented photographer is resting, right? PHOTOGRAPHER JAEMIN 1ST EXHIBITION",Positive
1046,1.81E+18,Sat Jul 13 14:14:18 +0000 2024,0,น้องชมพูหวานๆ น่ารักสุบๆไปเลยคับบ PHOTOGRAPHER JAEMIN 1ST EXHIBITION,1.81E+18,und,0,0,0,https://x.com/PoooohPR/status/1812128424544415894,846333421,PoooohPR,Sweet pink girl So cute. PHOTOGRAPHER JAEMIN 1ST EXHIBITION,Positive
1047,1.81E+18,Sat Jul 13 14:48:43 +0000 2024,0,die schönsten Hoodies,1.81E+18,de,0,0,0,https://x.com/jaemininarak/status/1812137086147015061,1.10E+18,jaemininarak,the most beautiful hoodies,Positive
1048,1.81E+18,Sat Jul 13 14:15:36 +0000 2024,0,DAY 15 our project leader and photographer PHOTOGRAPHER JAEMIN 1ST EXHIBITION,1.81E+18,en,0,0,0,https://x.com/cinnamononoo/status/1812128752530489373,1.66E+18,cinnamononoo,DAY 15 our project leader and photographer PHOTOGRAPHER JAEMIN 1ST EXHIBITION,Positive
1049,1.81E+18,Sat Jul 13 12:36:20 +0000 2024,1,ซื้อชั้นวางใสมาใช้ วางLP น้องแจมินแล้วรุ้สึกว่าห้องดูติดแกรมขึ้น200,1.81E+18,th,0,1,5,https://x.com/Itsfirst_2nd/status/1812103769104290012,8.21E+17,Itsfirst_2nd,Bought a clear shelf and used it to place Little Jaemin's LP and felt like the viewing room got 200 grams.,Positive
1050,1.81E+18,Sat Jul 13 14:09:13 +0000 2024,0,NANA MAGAZINE ISSUE HAS ARRIVED PHOTOGRAPHER JAEMIN 1ST EXHIBITION,1.81E+18,en,1,0,0,https://x.com/31x04dwahhx/status/1812127143150973202,213950623,31x04dwahhx,NANA MAGAZINE ISSUE HAS ARRIVED PHOTOGRAPHER JAEMIN 1ST EXHIBITION,Neutral
1051,1.81E+18,Sat Jul 13 13:41:01 +0000 2024,241,มาร่วมกันแท็กเป็นกำลังใจคุณช่างภาพ ด้วยการแชร์ภาพพร้อมติดแท็กกันค่ะ 𝗗𝗔𝗬 𝟭𝟱 แชร์รูปของแจมินกับสีผมที่ชอบที่สุด Your favorite JAEMIN s hair color PHOTOGRAPHER JAEMIN 1ST EXHIBITION,1.81E+18,th,3,119,634,https://x.com/jaemin_th/status/1812120048515076194,3235352208,jaemin_th,Let's come together and tag to support photographers. By sharing pictures and tagging 𝗗𝗔𝗬 𝟭𝟱 Share pictures of Jaemin with your favorite hair color. Your favorite JAEMIN s hair color PHOTOGRAPHER JAEMIN 1ST EXHIBITION,Positive
1052,1.81E+18,Sat Jul 13 14:46:27 +0000 2024,4,Sleep tight my photographer PHOTOGRAPHER JAEMIN 1ST EXHIBITION,1.81E+18,en,0,0,12,https://x.com/onyourjbow/status/1812136512693440821,1.12E+18,onyourjbow,Sleep tight my photographer PHOTOGRAPHER JAEMIN 1ST EXHIBITION,Positive
1053,1.81E+18,Sat Jul 13 14:35:08 +0000 2024,4,ห้องนี้เป็นห้องที่เซอไพร์ละชอบสุดในนิทรรศการเลย มันมีลูกเล่นยุ ห้องจำลองเหมือนได้ลองเปนคนล้างรูปส่องดูรายละเอียดภาพที่ถ่ายออกมา อยู่เพลินมากๆ,1.81E+18,th,0,1,0,https://x.com/wrtorn/status/1812133667789316380,2739208610,wrtorn,This room is the most surprising and favorite room in the exhibition. It has gimmicks. The simulation room is like trying to be a photo editor and looking at the details of the photos that were taken. Very enjoyable stay,Positive
1054,1.81E+18,Sat Jul 13 14:13:08 +0000 2024,0,ใครจะทำแบบน้องแจมินได้ ยิ้มเห็นฟันข้างบนไม่เกินหกซี่ PHOTOGRAPHER JAEMIN 1ST EXHIBITION,1.81E+18,th,0,0,0,https://x.com/bubble25000/status/1812128128556483034,2470747548,bubble25000,Who can do what Jaemin does? Smile with no more than six teeth visible at the top. PHOTOGRAPHER JAEMIN 1ST EXHIBITION,Positive
1055,1.81E+18,Wed Jul 17 03:00:02 +0000 2024,8686,NARCISSISM JAEMIN 1st PHOTO EXHIBITION VISITOR GUIDE NOTICE,1.81E+18,en,647,199,6720,https://x.com/NA_RCISSISM_/status/1813408290807640328,1.80E+18,NA_RCISSISM_,NARCISSISM JAEMIN 1st PHOTO EXHIBITION VISITOR GUIDE NOTICE,Neutral
1056,1.81E+18,Wed Jul 17 15:13:33 +0000 2024,1849,pick up,1.81E+18,en,11,0,1354,https://x.com/Mingocken/status/1813592886807806387,1.59E+18,Mingocken,pick up,Neutral
1057,1.81E+18,Wed Jul 17 03:15:44 +0000 2024,381,1 reply 1 like for our photographer jaeminie วันนี้ประกาศอย่างเป็นทางการแล้วว่านิทรรศการจะขยายถึงวันที่ 31 07 แถมยังประกาศอีเว้นรอบสอง แล้วยังมีกู้ดรอบ 2 มาโชว์ตัวที่งานด้วย PHOTOGRAPHER JAEMIN 1ST EXHIBITION,1.81E+18,th,2,297,1374,https://x.com/mcdtournesol/status/1813412241695531163,595455100,mcdtournesol,"1 reply 1 like for our photographer jaeminie Today it was officially announced that the exhibition will be extended until 31 07 and also announced a second round of events. And there is also Good, round 2, coming to show at the event as well. PHOTOGRAPHER JAEMIN 1ST EXHIBITION",Positive
1058,1.81E+18,Wed Jul 17 03:31:34 +0000 2024,308,ขอเสียงให้แจมมี่หน่อ ค้า ฉลองงา ขยายเวล PHOTOGRAPHER JAEMIN 1ST EXHIBITION,1.81E+18,und,0,137,993,https://x.com/withmindie/status/1813416223763484945,208479167,withmindie,"Requesting a voice for Jammy Nokkha to celebrate Sesame, extending the time PHOTOGRAPHER JAEMIN 1ST EXHIBITION",Positive
1059,1.81E+18,Thu Jul 18 02:31:47 +0000 2024,100,1 mention for jaemin Day20 w เวลาผ่านไปเร็วมากๆ แจมินเก่งมากจริงๆ การเตรียมงานต่างๆแจมินวางแพลนมาอย่างดีเลย ดีใจที่แจมินได้ทำสิ่งที่ชอบและได้ผลตอบรับที่ดีขนาดนี้ PHOTOGRAPHER JAEMIN 1ST EXHIBITION,1.81E+18,th,0,100,332,https://x.com/thereisjaemin/status/1813763570527858807,1.17E+18,thereisjaemin,1 mention for jaemin Day20 w Time flies so fast. Jaemin is really talented. Jaemin's preparation for various events was well planned. I'm glad that Jaemin is able to do what he likes and get such good feedback. PHOTOGRAPHER JAEMIN 1ST EXHIBITION,Positive
1060,1.81E+18,Thu Jul 18 03:11:06 +0000 2024,265,1 like 1 reply for วันนี้ก็แวะมาขอคนละเมนชั่น เป็นกำลังใจให้คุณช่างภาพแจมินของเรากันอีกวันค่ะ ขอให้ทุกคนมีวันที่น่ารักนะคะ PHOTOGRAPHER JAEMIN,1.81E+18,th,0,331,936,https://x.com/mcdtournesol/status/1813773462986449076,595455100,mcdtournesol,1 like 1 reply for Today I stopped by to ask for a different comment. Let's cheer up for our photographer Jaemin for another day. Hope everyone has a lovely day. PHOTOGRAPHER JAEMIN,Positive
1061,1.81E+18,Fri Jul 19 10:46:26 +0000 2024,173,บูสบูสเอนเนอจี้ยามเยน ขอ 1 rt 1 mention ให้คุณช่างภาพ คนเก่งหน่อยค่ะ ฅ ̳ · ̳ฅ PHOTOGRAPHER JAEMIN,1.81E+18,th,0,129,458,https://x.com/_mytriplej/status/1814250438080045197,1.28E+18,_mytriplej,Boost Boost Energy when you get 1 rt 1 mention for the photographer. Please be a smart person. ฅ ̳ · ̳ฅ PHOTOGRAPHER JAEMIN,Positive
